{
  "domain": "trade-operation-dispatch",
  "version": 2,
  "sample_id": "record-004",
  "actors": [
    "省级商务部门",
    "市州调度人员",
    "外贸企业",
    "货运协调人员",
    "口岸数据提供方"
  ],
  "facts": [
    "当地建立日监测周调度机制",
    "重点企业接受一企一策服务",
    "特色产品出口与原料进口共同影响外贸运行",
    "进口在三十二个月后恢复两位数增长",
    "热带水果、矿石原料、冷水鱼和盐湖化工是重点监测品类",
    "同一票货物可能由企业、市州或口岸多方重复报送",
    "部分报关结果迟于所属统计期间才获知",
    "月末汇总无法支撑日监测和周调度的时效要求"
  ],
  "constraints": [
    "进出口事件归并",
    "日监测周调度",
    "企业服务事项",
    "统计版本解释",
    "同一票货物只计一次",
    "迟到数据归入实际统计期间并注明获知时间",
    "已发布口径与结论保留原版本",
    "企业仅处理自身申报和服务事项",
    "市州承担辖区协调",
    "省级增减值可下钻到货物、商品类别与数据来源",
    "一企一策承诺闭环进入下一次周研判"
  ],
  "platform": {
    "name": "外贸运行日监测平台",
    "levels": [
      "企业",
      "市州",
      "省级"
    ],
    "cadence": "日监测、周调度",
    "monitored_commodities": [
      "热带水果",
      "矿石原料",
      "冷水鱼",
      "盐湖化工"
    ],
    "dedup": "同一票货物以报关单号为唯一标识，无论由谁报送只计一次",
    "late_arrival": "迟到的报关结果归入实际统计期间，并注明获知时间",
    "publication": "已经发布的口径与结论保留原版本，修订生成新版本",
    "access": {
      "enterprise": "企业登录后只处理自身申报和服务事项",
      "prefecture": "市州承担辖区协调",
      "province": "省级视图沿每个增减值下钻到货物、商品类别与数据来源"
    },
    "commitment": {
      "fields": [
        "责任人",
        "承诺期限",
        "办理结果"
      ],
      "carry_into": "下一次周研判"
    }
  }
}
